
================================================================================
IMPROVED HEURISTIC ENGINE VALIDATION TEST
Testing all opening rolls against backgammon theory
================================================================================

================================================================================
Testing Opening Roll: 1-1
Expected Best: 8/7(2) 6/5(2)
================================================================================


Top 10 Heuristic Rankings:
Rank | Score  | Move
-----|--------|----------------------------------------
   1 | 2.6900 | 8/7(2) 6/5(2) ★
   2 | 2.3244 | 24/23(2) 6/5(2)
   3 | 2.2936 | 24/23(2) 8/7(2)
   4 | 2.1704 | 8/7 7/6 6/5(2)
   5 | 2.1279 | 24/23 6/5(3)
   6 | 2.1258 | 24/23 23/22 6/5(2)
   7 | 2.0971 | 8/7 6/5(3)
   8 | 2.0952 | 24/23 23/22 8/7(2)
   9 | 2.0841 | 24/23 8/7 6/5(2)
  10 | 2.0654 | 6/5(3) 5/4

✅ PASS: Expected move "8/7(2) 6/5(2)" ranked #1

📊 Heuristic Breakdown for #1 move:
  Escape Progress:   0.0000 (value: 0.00)
  Anchor Value:      0.1440 (value: 0.80)
  Builder Coverage:  0.1250 (bonus: 0.50)
  Connectivity:      0.2000 (value: 2.00)
  Points Made:       0.7150 (count: 2)
  Blots:             -0.0104 (count: 1)
  Hits:              0.0000 (count: 0)
  Pip Gain:          0.8000 (value: 4)

================================================================================
Testing Opening Roll: 2-1
Expected Best: 13/11 6/5
================================================================================


Top 10 Heuristic Rankings:
Rank | Score  | Move
-----|--------|----------------------------------------
   1 | 1.6426 | 24/23 13/11
   2 | 1.6132 | 13/11 11/10
   3 | 1.5739 | 13/11 8/7
   4 | 1.5463 | 13/11 6/5 ★
   5 | 1.4812 | 8/7 8/6
   6 | 1.3787 | 24/23 8/6
   7 | 1.3117 | 24/22 8/7
   8 | 1.3011 | 24/22 22/21
   9 | 1.2912 | 8/6 6/5
  10 | 1.2647 | 24/23 6/4

❌ FAIL: Expected move "13/11 6/5" ranked #4

📊 Heuristic Breakdown for #1 move:
  Escape Progress:   0.1500 (value: 0.50)
  Anchor Value:      0.0000 (value: 0.00)
  Builder Coverage:  0.2500 (bonus: 1.00)
  Connectivity:      0.2000 (value: 2.00)
  Points Made:       0.0000 (count: 0)
  Blots:             -0.0338 (count: 3)
  Hits:              0.0000 (count: 0)
  Pip Gain:          0.6000 (value: 3)

================================================================================
Testing Opening Roll: 2-2
Expected Best: 13/11(2) 6/4(2)
================================================================================


Top 10 Heuristic Rankings:
Rank | Score  | Move
-----|--------|----------------------------------------
   1 | 3.2252 | 13/11(2) 6/4(2) ★
   2 | 3.1781 | 13/11 8/6 6/4(2)
   3 | 3.1081 | 13/11 6/4(3)
   4 | 3.1036 | 13/11 11/9 6/4(2)
   5 | 3.0879 | 24/22 13/11 6/4(2)
   6 | 3.0392 | 8/6(2) 6/4(2)
   7 | 3.0257 | 24/22(2) 6/4(2)
   8 | 2.9922 | 13/11(2) 8/6(2)
   9 | 2.9002 | 24/22 13/11 8/6(2)
  10 | 2.8845 | 13/11 11/9 8/6(2)

✅ PASS: Expected move "13/11(2) 6/4(2)" ranked #1

📊 Heuristic Breakdown for #1 move:
  Escape Progress:   0.0000 (value: 0.00)
  Anchor Value:      0.1440 (value: 0.80)
  Builder Coverage:  0.1250 (bonus: 0.50)
  Connectivity:      0.2000 (value: 2.00)
  Points Made:       0.6820 (count: 2)
  Blots:             0.0000 (count: 0)
  Hits:              0.0000 (count: 0)
  Pip Gain:          1.6000 (value: 8)

================================================================================
Testing Opening Roll: 3-1
Expected Best: 8/5 6/5
================================================================================


Top 10 Heuristic Rankings:
Rank | Score  | Move
-----|--------|----------------------------------------
   1 | 2.1704 | 8/5 6/5 ★
   2 | 1.8392 | 24/23 13/10
   3 | 1.8087 | 13/10 10/9
   4 | 1.7715 | 13/10 8/7
   5 | 1.7443 | 13/10 6/5
   6 | 1.6400 | 8/7 8/5
   7 | 1.5311 | 24/23 8/5
   8 | 1.5100 | 24/21 8/7
   9 | 1.5000 | 24/21 21/20
  10 | 1.4954 | 8/5 5/4

✅ PASS: Expected move "8/5 6/5" ranked #1

📊 Heuristic Breakdown for #1 move:
  Escape Progress:   0.0000 (value: 0.00)
  Anchor Value:      0.1440 (value: 0.80)
  Builder Coverage:  0.0000 (bonus: 0.00)
  Connectivity:      0.1200 (value: 1.20)
  Points Made:       0.4400 (count: 1)
  Blots:             0.0000 (count: 0)
  Hits:              0.0000 (count: 0)
  Pip Gain:          0.8000 (value: 4)

================================================================================
Testing Opening Roll: 3-2
Expected Best: 24/21 13/11
================================================================================


Top 10 Heuristic Rankings:
Rank | Score  | Move
-----|--------|----------------------------------------
   1 | 2.3099 | 13/11 13/10
   2 | 2.0864 | 13/10 8/6
   3 | 2.0382 | 24/21 13/11 ★
   4 | 2.0376 | 24/22 13/10
   5 | 2.0195 | 13/11 8/5
   6 | 1.9634 | 13/11 6/3
   7 | 1.9483 | 13/10 6/4
   8 | 1.8985 | 8/6 8/5
   9 | 1.7743 | 24/21 8/6
  10 | 1.7302 | 24/22 8/5

❌ FAIL: Expected move "24/21 13/11" ranked #3

📊 Heuristic Breakdown for #1 move:
  Escape Progress:   0.0000 (value: 0.00)
  Anchor Value:      0.1440 (value: 0.80)
  Builder Coverage:  0.5000 (bonus: 2.00)
  Connectivity:      0.2000 (value: 2.00)
  Points Made:       0.0000 (count: 0)
  Blots:             -0.0105 (count: 2)
  Hits:              0.0000 (count: 0)
  Pip Gain:          1.0000 (value: 5)

================================================================================
Testing Opening Roll: 3-3
Expected Best: 8/5(2) 6/3(2)
================================================================================


Top 10 Heuristic Rankings:
Rank | Score  | Move
-----|--------|----------------------------------------
   1 | 4.4118 | 13/10(2) 8/5(2)
   2 | 4.3529 | 24/21(2) 8/5(2)
   3 | 4.3302 | 8/5(2) 6/3(2) ★
   4 | 4.2998 | 24/21 21/18 8/5(2)
   5 | 4.2718 | 24/21 13/10 8/5(2)
   6 | 4.1940 | 13/10 8/5(2) 6/3
   7 | 4.1702 | 13/10 8/5(3)
   8 | 3.9649 | 13/10 10/7 8/5(2)
   9 | 3.9369 | 24/21 8/5(2) 6/3
  10 | 3.8658 | 13/10(2) 6/3(2)

❌ FAIL: Expected move "8/5(2) 6/3(2)" ranked #3

📊 Heuristic Breakdown for #1 move:
  Escape Progress:   0.0000 (value: 0.00)
  Anchor Value:      0.1440 (value: 0.80)
  Builder Coverage:  0.2500 (bonus: 1.00)
  Connectivity:      0.2000 (value: 2.00)
  Points Made:       0.6820 (count: 2)
  Blots:             -0.0104 (count: 1)
  Hits:              0.0000 (count: 0)
  Pip Gain:          2.4000 (value: 12)

================================================================================
Testing Opening Roll: 4-1
Expected Best: 24/23 13/9
================================================================================


Top 10 Heuristic Rankings:
Rank | Score  | Move
-----|--------|----------------------------------------
   1 | 2.0353 | 24/23 13/9 ★
   2 | 1.9687 | 13/9 8/7
   3 | 1.9419 | 13/9 6/5
   4 | 1.8424 | 8/7 8/4
   5 | 1.7347 | 24/23 8/4
   6 | 1.7110 | 8/4 6/5
   7 | 1.7093 | 24/20 8/7
   8 | 1.7086 | 8/4 4/3
   9 | 1.6811 | 24/23 6/2
  10 | 1.6804 | 13/9 9/8

✅ PASS: Expected move "24/23 13/9" ranked #1

📊 Heuristic Breakdown for #1 move:
  Escape Progress:   0.1500 (value: 0.50)
  Anchor Value:      0.0000 (value: 0.00)
  Builder Coverage:  0.2500 (bonus: 1.00)
  Connectivity:      0.2000 (value: 2.00)
  Points Made:       0.0000 (count: 0)
  Blots:             -0.0411 (count: 3)
  Hits:              0.0000 (count: 0)
  Pip Gain:          1.0000 (value: 5)

================================================================================
Testing Opening Roll: 4-2
Expected Best: 8/4 6/4
================================================================================


Top 10 Heuristic Rankings:
Rank | Score  | Move
-----|--------|----------------------------------------
   1 | 2.5070 | 13/11 13/9
   2 | 2.4518 | 8/4 6/4 ★
   3 | 2.2833 | 13/9 8/6
   4 | 2.2386 | 24/20 13/11
   5 | 2.2351 | 24/22 13/9
   6 | 2.2250 | 13/11 8/4
   7 | 2.2086 | 24/20 20/18
   8 | 2.1702 | 13/11 6/2
   9 | 2.1473 | 13/9 6/4
  10 | 2.1037 | 8/6 8/4

❌ FAIL: Expected move "8/4 6/4" ranked #2

📊 Heuristic Breakdown for #1 move:
  Escape Progress:   0.0000 (value: 0.00)
  Anchor Value:      0.1440 (value: 0.80)
  Builder Coverage:  0.5000 (bonus: 2.00)
  Connectivity:      0.2000 (value: 2.00)
  Points Made:       0.0000 (count: 0)
  Blots:             -0.0148 (count: 2)
  Hits:              0.0000 (count: 0)
  Pip Gain:          1.2000 (value: 6)

================================================================================
Testing Opening Roll: 4-3
Expected Best: 24/20 13/10
================================================================================


Top 10 Heuristic Rankings:
Rank | Score  | Move
-----|--------|----------------------------------------
   1 | 2.7046 | 13/10 13/9
   2 | 2.4366 | 24/20 13/10 ★
   3 | 2.4339 | 24/21 13/9
   4 | 2.4243 | 13/10 8/4
   5 | 2.4179 | 13/9 8/5
   6 | 2.3692 | 13/10 6/2
   7 | 2.3613 | 13/9 6/3
   8 | 2.3030 | 8/5 8/4
   9 | 2.1564 | 13/9 9/6
  10 | 2.1351 | 24/21 8/4

❌ FAIL: Expected move "24/20 13/10" ranked #2

📊 Heuristic Breakdown for #1 move:
  Escape Progress:   0.0000 (value: 0.00)
  Anchor Value:      0.1440 (value: 0.80)
  Builder Coverage:  0.5000 (bonus: 2.00)
  Connectivity:      0.2000 (value: 2.00)
  Points Made:       0.0000 (count: 0)
  Blots:             -0.0186 (count: 2)
  Hits:              0.0000 (count: 0)
  Pip Gain:          1.4000 (value: 7)

================================================================================
Testing Opening Roll: 4-4
Expected Best: 24/20(2) 13/9(2)
================================================================================


Top 10 Heuristic Rankings:
Rank | Score  | Move
-----|--------|----------------------------------------
   1 | 5.0974 | 13/9(2) 8/4(2)
   2 | 5.0205 | 24/20(2) 8/4(2)
   3 | 4.9828 | 8/4(2) 6/2(2)
   4 | 4.9503 | 24/20 13/9 8/4(2)
   5 | 4.9428 | 24/20 20/16 8/4(2)
   6 | 4.8803 | 13/9 8/4(2) 6/2
   7 | 4.8480 | 13/9 8/4(3)
   8 | 4.7584 | 13/9(2) 6/2(2)
   9 | 4.6862 | 13/9 9/5 8/4(2)
  10 | 4.6267 | 24/20 8/4(2) 6/2

❌ FAIL: Expected move "24/20(2) 13/9(2)" ranked #not found

📊 Heuristic Breakdown for #1 move:
  Escape Progress:   0.0000 (value: 0.00)
  Anchor Value:      0.1440 (value: 0.80)
  Builder Coverage:  0.2500 (bonus: 1.00)
  Connectivity:      0.2000 (value: 2.00)
  Points Made:       0.6820 (count: 2)
  Blots:             -0.0104 (count: 1)
  Hits:              0.0000 (count: 0)
  Pip Gain:          3.2000 (value: 16)

================================================================================
Testing Opening Roll: 5-1
Expected Best: 24/23 13/8
================================================================================


Top 10 Heuristic Rankings:
Rank | Score  | Move
-----|--------|----------------------------------------
   1 | 2.2086 | 24/23 23/18
   2 | 2.0513 | 8/7 8/3
   3 | 1.9477 | 24/23 8/3
   4 | 1.9193 | 8/3 6/5
   5 | 1.9155 | 8/3 3/2
   6 | 1.9069 | 24/23 13/8 ★
   7 | 1.8774 | 13/8 8/7
   8 | 1.8194 | 13/8 6/5

❌ FAIL: Expected move "24/23 13/8" ranked #6

📊 Heuristic Breakdown for #1 move:
  Escape Progress:   0.4500 (value: 1.50)
  Anchor Value:      0.0000 (value: 0.00)
  Builder Coverage:  0.0000 (bonus: 0.00)
  Connectivity:      0.1400 (value: 1.40)
  Points Made:       0.0000 (count: 0)
  Blots:             -0.0592 (count: 2)
  Hits:              0.0000 (count: 0)
  Pip Gain:          1.2000 (value: 6)

================================================================================
Testing Opening Roll: 5-2
Expected Best: 24/22 13/8
================================================================================


Top 10 Heuristic Rankings:
Rank | Score  | Move
-----|--------|----------------------------------------
   1 | 2.4394 | 13/11 8/3
   2 | 2.4199 | 13/11 13/8
   3 | 2.3172 | 8/6 8/3
   4 | 2.1564 | 13/8 8/6
   5 | 2.1481 | 24/22 8/3
   6 | 2.1232 | 8/3 6/4
   7 | 2.1067 | 24/22 13/8 ★
   8 | 2.0250 | 13/8 6/4

❌ FAIL: Expected move "24/22 13/8" ranked #7

📊 Heuristic Breakdown for #1 move:
  Escape Progress:   0.0000 (value: 0.00)
  Anchor Value:      0.1440 (value: 0.80)
  Builder Coverage:  0.2500 (bonus: 1.00)
  Connectivity:      0.2000 (value: 2.00)
  Points Made:       0.0000 (count: 0)
  Blots:             -0.1038 (count: 2)
  Hits:              0.0000 (count: 0)
  Pip Gain:          1.4000 (value: 7)

================================================================================
Testing Opening Roll: 5-3
Expected Best: 8/3 6/3
================================================================================


Top 10 Heuristic Rankings:
Rank | Score  | Move
-----|--------|----------------------------------------
   1 | 2.6896 | 8/3 6/3 ★
   2 | 2.6385 | 13/10 8/3
   3 | 2.6174 | 13/10 13/8
   4 | 2.5727 | 24/21 21/16
   5 | 2.5107 | 8/5 8/3
   6 | 2.3499 | 24/21 8/3
   7 | 2.3074 | 24/21 13/8
   8 | 2.2954 | 13/8 8/5
   9 | 2.2396 | 13/8 6/3

✅ PASS: Expected move "8/3 6/3" ranked #1

📊 Heuristic Breakdown for #1 move:
  Escape Progress:   0.0000 (value: 0.00)
  Anchor Value:      0.1440 (value: 0.80)
  Builder Coverage:  0.0000 (bonus: 0.00)
  Connectivity:      0.1200 (value: 1.20)
  Points Made:       0.2750 (count: 1)
  Blots:             0.0000 (count: 0)
  Hits:              0.0000 (count: 0)
  Pip Gain:          1.6000 (value: 8)

================================================================================
Testing Opening Roll: 5-4
Expected Best: 24/20 13/8
================================================================================


Top 10 Heuristic Rankings:
Rank | Score  | Move
-----|--------|----------------------------------------
   1 | 2.8373 | 13/9 8/3
   2 | 2.8143 | 13/9 13/8
   3 | 2.7741 | 24/20 20/15
   4 | 2.7143 | 8/4 8/3
   5 | 2.5507 | 24/20 8/3
   6 | 2.5371 | 8/3 6/2
   7 | 2.5077 | 24/20 13/8 ★
   8 | 2.5010 | 13/8 8/4
   9 | 2.4465 | 13/8 6/2

❌ FAIL: Expected move "24/20 13/8" ranked #7

📊 Heuristic Breakdown for #1 move:
  Escape Progress:   0.0000 (value: 0.00)
  Anchor Value:      0.1440 (value: 0.80)
  Builder Coverage:  0.2500 (bonus: 1.00)
  Connectivity:      0.2000 (value: 2.00)
  Points Made:       0.0000 (count: 0)
  Blots:             -0.1087 (count: 2)
  Hits:              0.0000 (count: 0)
  Pip Gain:          1.8000 (value: 9)

================================================================================
Testing Opening Roll: 5-5
Expected Best: 13/8(2) 6/1(2)
================================================================================


Top 10 Heuristic Rankings:
Rank | Score  | Move
-----|--------|----------------------------------------
   1 | 5.3610 | 13/8 8/3(3)
   2 | 5.1764 | 13/8(2) 8/3(2)
   3 | 4.7296 | 13/8(3) 8/3
   4 | 4.6696 | 13/8(4)

❌ FAIL: Expected move "13/8(2) 6/1(2)" ranked #not found

📊 Heuristic Breakdown for #1 move:
  Escape Progress:   0.0000 (value: 0.00)
  Anchor Value:      0.1440 (value: 0.80)
  Builder Coverage:  0.1250 (bonus: 0.50)
  Connectivity:      0.1200 (value: 1.20)
  Points Made:       0.2750 (count: 1)
  Blots:             -0.0104 (count: 1)
  Hits:              0.0000 (count: 0)
  Pip Gain:          4.0000 (value: 20)

================================================================================
Testing Opening Roll: 6-1
Expected Best: 13/7 8/7
================================================================================


Top 10 Heuristic Rankings:
Rank | Score  | Move
-----|--------|----------------------------------------
   1 | 2.6882 | 13/7 8/7 ★
   2 | 2.3979 | 24/18 8/7
   3 | 2.3790 | 24/18 6/5
   4 | 2.2559 | 8/7 8/2
   5 | 2.2556 | 24/23 24/18
   6 | 2.1564 | 13/7 7/6
   7 | 2.1539 | 24/23 8/2
   8 | 2.1236 | 8/2 6/5
   9 | 2.1155 | 24/23 13/7
  10 | 2.0514 | 13/7 6/5

✅ PASS: Expected move "13/7 8/7" ranked #1

📊 Heuristic Breakdown for #1 move:
  Escape Progress:   0.0000 (value: 0.00)
  Anchor Value:      0.1440 (value: 0.80)
  Builder Coverage:  0.0000 (bonus: 0.00)
  Connectivity:      0.1500 (value: 1.50)
  Points Made:       0.2750 (count: 1)
  Blots:             0.0000 (count: 0)
  Hits:              0.0000 (count: 0)
  Pip Gain:          1.4000 (value: 7)

================================================================================
Testing Opening Roll: 6-2
Expected Best: 24/18
================================================================================


Top 10 Heuristic Rankings:
Rank | Score  | Move
-----|--------|----------------------------------------
   1 | 2.9209 | 24/18 13/11
   2 | 2.6867 | 24/18 8/6
   3 | 2.6462 | 13/11 8/2
   4 | 2.5857 | 24/18 6/4
   5 | 2.5781 | 13/11 13/7
   6 | 2.5727 | 24/18 18/16
   7 | 2.5237 | 8/6 8/2
   8 | 2.4576 | 24/22 24/18
   9 | 2.3564 | 24/22 8/2
  10 | 2.3534 | 13/7 8/6

❌ FAIL: Expected move "24/18" ranked #not found

📊 Heuristic Breakdown for #1 move:
  Escape Progress:   0.4500 (value: 1.50)
  Anchor Value:      0.0000 (value: 0.00)
  Builder Coverage:  0.2500 (bonus: 1.00)
  Connectivity:      0.2000 (value: 2.00)
  Points Made:       0.0000 (count: 0)
  Blots:             -0.0618 (count: 3)
  Hits:              0.0000 (count: 0)
  Pip Gain:          1.6000 (value: 8)

================================================================================
Testing Opening Roll: 6-3
Expected Best: 24/18 13/10
================================================================================


Top 10 Heuristic Rankings:
Rank | Score  | Move
-----|--------|----------------------------------------
   1 | 3.1193 | 24/18 13/10 ★
   2 | 2.8539 | 24/18 8/5
   3 | 2.8452 | 13/10 8/2
   4 | 2.7972 | 24/18 6/3
   5 | 2.7771 | 13/10 13/7
   6 | 2.7741 | 24/18 18/15
   7 | 2.7147 | 8/5 8/2
   8 | 2.6567 | 24/21 24/18
   9 | 2.5561 | 24/21 8/2
  10 | 2.5371 | 8/2 6/3

✅ PASS: Expected move "24/18 13/10" ranked #1

📊 Heuristic Breakdown for #1 move:
  Escape Progress:   0.4500 (value: 1.50)
  Anchor Value:      0.0000 (value: 0.00)
  Builder Coverage:  0.2500 (bonus: 1.00)
  Connectivity:      0.2000 (value: 2.00)
  Points Made:       0.0000 (count: 0)
  Blots:             -0.0648 (count: 3)
  Hits:              0.0000 (count: 0)
  Pip Gain:          1.8000 (value: 9)

================================================================================
Testing Opening Roll: 6-4
Expected Best: 24/18 13/9
================================================================================


Top 10 Heuristic Rankings:
Rank | Score  | Move
-----|--------|----------------------------------------
   1 | 3.3174 | 24/18 13/9 ★
   2 | 3.0594 | 8/2 6/2
   3 | 3.0585 | 24/18 8/4
   4 | 3.0439 | 13/9 8/2
   5 | 3.0068 | 24/18 18/14
   6 | 3.0028 | 24/18 6/2
   7 | 2.9757 | 13/9 13/7
   8 | 2.9185 | 8/4 8/2
   9 | 2.8572 | 24/20 24/18
  10 | 2.7568 | 24/20 8/2

✅ PASS: Expected move "24/18 13/9" ranked #1

📊 Heuristic Breakdown for #1 move:
  Escape Progress:   0.4500 (value: 1.50)
  Anchor Value:      0.0000 (value: 0.00)
  Builder Coverage:  0.2500 (bonus: 1.00)
  Connectivity:      0.2000 (value: 2.00)
  Points Made:       0.0000 (count: 0)
  Blots:             -0.0681 (count: 3)
  Hits:              0.0000 (count: 0)
  Pip Gain:          2.0000 (value: 10)

================================================================================
Testing Opening Roll: 6-5
Expected Best: 24/18 18/13
================================================================================


Top 10 Heuristic Rankings:
Rank | Score  | Move
-----|--------|----------------------------------------
   1 | 3.2700 | 24/18 8/3
   2 | 3.2177 | 24/18 13/8
   3 | 3.1869 | 24/18 18/13 ★
   4 | 3.1273 | 8/3 8/2
   5 | 2.9410 | 13/7 8/3
   6 | 2.9225 | 13/8 8/2
   7 | 2.8844 | 13/8 13/7

❌ FAIL: Expected move "24/18 18/13" ranked #3

📊 Heuristic Breakdown for #1 move:
  Escape Progress:   0.4500 (value: 1.50)
  Anchor Value:      0.0000 (value: 0.00)
  Builder Coverage:  0.0000 (bonus: 0.00)
  Connectivity:      0.2000 (value: 2.00)
  Points Made:       0.0000 (count: 0)
  Blots:             -0.1369 (count: 3)
  Hits:              0.0000 (count: 0)
  Pip Gain:          2.2000 (value: 11)

================================================================================
Testing Opening Roll: 6-6
Expected Best: 24/18(2) 13/7(2)
================================================================================


Top 10 Heuristic Rankings:
Rank | Score  | Move
-----|--------|----------------------------------------
   1 | 6.8751 | 24/18(2) 13/7(2) ★
   2 | 6.8267 | 24/18(2) 8/2(2)
   3 | 6.5386 | 13/7(2) 8/2(2)
   4 | 6.4109 | 24/18 13/7(3)
   5 | 6.4074 | 24/18 13/7(2) 8/2
   6 | 6.3424 | 24/18 13/7 8/2(2)
   7 | 6.2957 | 24/18(2) 13/7 8/2
   8 | 6.2645 | 24/18 8/2(3)
   9 | 6.1357 | 13/7(3) 8/2
  10 | 6.0738 | 13/7(4)

✅ PASS: Expected move "24/18(2) 13/7(2)" ranked #1

📊 Heuristic Breakdown for #1 move:
  Escape Progress:   0.6000 (value: 2.00)
  Anchor Value:      0.0000 (value: 0.00)
  Builder Coverage:  0.0000 (bonus: 0.00)
  Connectivity:      0.1800 (value: 1.80)
  Points Made:       0.5500 (count: 2)
  Blots:             0.0000 (count: 0)
  Hits:              0.0000 (count: 0)
  Pip Gain:          4.8000 (value: 24)


================================================================================
SUMMARY
================================================================================

Total Tests: 21
Passed: 9 (42.9%)
Failed: 12 (57.1%)

❌ Failed Tests:
  21: Expected "13/11 6/5" but got "24/23 13/11" (rank #4)
  32: Expected "24/21 13/11" but got "13/11 13/10" (rank #3)
  33: Expected "8/5(2) 6/3(2)" but got "13/10(2) 8/5(2)" (rank #3)
  42: Expected "8/4 6/4" but got "13/11 13/9" (rank #2)
  43: Expected "24/20 13/10" but got "13/10 13/9" (rank #2)
  44: Expected "24/20(2) 13/9(2)" but got "13/9(2) 8/4(2)" (rank #999)
  51: Expected "24/23 13/8" but got "24/23 23/18" (rank #6)
  52: Expected "24/22 13/8" but got "13/11 8/3" (rank #7)
  54: Expected "24/20 13/8" but got "13/9 8/3" (rank #7)
  55: Expected "13/8(2) 6/1(2)" but got "13/8 8/3(3)" (rank #999)
  62: Expected "24/18" but got "24/18 13/11" (rank #999)
  65: Expected "24/18 18/13" but got "24/18 8/3" (rank #3)

================================================================================
